When can I return to school?,COVID_School_shutdown
when can my kid go back school,COVID_School_shutdown
ARE COLLEGES OPEN,COVID_School_shutdown
Are my children's schools closed?,COVID_School_shutdown
Are my schools closed,COVID_School_shutdown
are my schools closed?,COVID_School_shutdown
are schools closed,COVID_School_shutdown
are schools closed ?,COVID_School_shutdown
Will there be school in the summer?,COVID_School_shutdown
Will there be exams in the summer?,COVID_School_shutdown
Will students still graduate this year?,COVID_School_shutdown
when can i send my kids back to school,COVID_School_shutdown
when can kid go back to school,COVID_School_shutdown
when can kids return to school,COVID_School_shutdown
Will graduations be pushed back?,COVID_School_shutdown
Will classes be moved to summer?,COVID_School_shutdown
Which schools are closed?,COVID_School_shutdown
where can my kids go back to school,COVID_School_shutdown
When will the schools open?,COVID_School_shutdown
When will schools close?,COVID_School_shutdown
when will my kids school reopen,COVID_School_shutdown
When will my kids be back in school?,COVID_School_shutdown
When will my good go back to school?,COVID_School_shutdown
When is school back in session?,COVID_School_shutdown
When does covid vacation end?,COVID_School_shutdown
when do the children go back to school,COVID_School_shutdown
when can my kids go back to school,COVID_School_shutdown
when can my kids go back to college?,COVID_School_shutdown
when can my kid go back to school,COVID_School_shutdown
When can my kid go back to college,COVID_School_shutdown
are schools closed in my area,COVID_School_shutdown
are schools closed?,COVID_School_shutdown
are schools in my area closed,COVID_School_shutdown
are schools open,COVID_School_shutdown
Are schools open?,COVID_School_shutdown
Are schools shut down?,COVID_School_shutdown
Can my child go to school?,COVID_School_shutdown
How can I get the latest news on my school closure?,COVID_School_shutdown
How will the shutdown impact my child's attendance records?,COVID_School_shutdown
Is graduation delayed?,COVID_School_shutdown
Is HS 123 open?,COVID_School_shutdown
is my kids school closed,COVID_School_shutdown
Is my kids school closed?,COVID_School_shutdown
is my school closed,COVID_School_shutdown
Is my school closed?,COVID_School_shutdown
is the school closed,COVID_School_shutdown
Should my child stay home from school?,COVID_School_shutdown
What does the ordered school closure mean for report cards?,COVID_School_shutdown
What happens after the ordered three-week closure period ends?,COVID_School_shutdown
what schools are closed,COVID_School_shutdown
